{
  "fixture_envelope_version": "1.0",
  "fixture_id": "quantum-entanglement",
  "kind": "research-config",
  "description": "Golden research configuration for the quantum entanglement research journey.",
  "input": {
    "schema": "https://morpho.dev/schemas/research-config.v1.json",
    "payload": {
      "schema_version": "1.0",
      "config_id": "018f7a01-0000-7000-8000-000000000001",
      "project_id": "018f7a00-0000-7000-8000-000000000001",
      "domain": "physics",
      "topic": "quantum entanglement",
      "purpose": "research",
      "audience": "graduate physics students",
      "depth": 4,
      "dimensions": ["concepts", "history", "theory", "experiments", "papers", "recent developments", "future trends"],
      "time_range": {},
      "geographic_scope": "global",
      "languages": ["en"],
      "source_types": ["paper", "preprint", "encyclopedia", "textbook"],
      "source_domains": [],
      "update_frequency": "manual"
    }
  },
  "expected_outputs": [],
  "provenance": {
    "origin": "synthetic",
    "synthetic": true,
    "license": "CC0-1.0",
    "notes": "Synthetic configuration authored for offline testing. No real provider responses, personal data, or private research content."
  },
  "stability": {
    "deterministic": true,
    "ignored_fields": []
  }
}
